{
  "schema_version": 1,
  "inventory_id": "PB020.KICKOFF.NO_CLAIM_INVENTORY.2026_07",
  "status": "no_claim_kickoff_inventory",
  "updated": "2026-07-18",
  "claim_status": "Implementation kickoff inventory only; no broad M1 implementation claim, no developer preview claim, no beta claim, no stable claim, no production claim, no Chrome-class claim, no faster/lower-memory/lower-energy claim, no compatibility claim, no security claim, no accessibility claim, no daily-driver claim, no release readiness claim, no task approval claim, and no readiness promotion claim.",
  "source_records": [
    "docs/project-buildout/11-pre-build-readiness-checklist.md",
    "docs/project-buildout/13-build-readiness-operating-board.md",
    "docs/project-buildout/17-build-readiness-task-queue.md",
    "docs/project-buildout/18-documentation-readiness-evidence-matrix.md",
    "docs/research/pre-build-readiness-gap-audit-2026-07.md",
    "docs/project-buildout/machine/build-readiness-closure-review.schema.json",
    "docs/project-buildout/machine/build-readiness-closure-reviews/no-claim-build-readiness-closure-template.json",
    "docs/blueprint-v1/machine/pre-build-readiness.json",
    "docs/blueprint-v1/machine/build-readiness-task-queue.json",
    "docs/blueprint-v1/machine/research-readiness-crosswalk.json",
    "docs/agent-execution/README.md",
    "docs/production-readiness/README.md",
    "docs/blueprint-v1/20-definition-of-done.md"
  ],
  "readiness_items": [
    {
      "id": "PB-002",
      "name": "Engine source strategy and Servo relationship",
      "status": "blocked",
      "owner_scope": "architecture",
      "current_evidence": [
        "ADR-0009 source-strategy packet, decision draft, evidence matrix, Servo source, provenance, license, generated-output, unsafe, build-reproduction, compatibility, performance, security, and maintenance reports exist as no-claim research."
      ],
      "required_before_m1": [
        "Accepted ADR-0009 with owner-selected source baseline, accepted provenance/equivalence policy, license/advisory/SBOM decisions, clean-target reproduction, component-boundary review, JavaScript-runtime decision, compatibility denominator, performance baseline, security implications, maintenance model, and public-claim diff."
      ],
      "first_next_actions": [
        "Complete the ADR-0009 decision packet and evidence registry gaps before any release-path source import or source-strategy-dependent implementation expands."
      ],
      "owner_only_decisions": [
        "Select or reject the source baseline, accept equivalence/provenance policy, approve component boundaries, and decide whether any Servo-derived release path is allowed."
      ],
      "prohibited_claims": [
        "No Servo adoption, dependency approval, component approval, compatibility, security, performance, memory, support, release, production, or implementation claim."
      ],
      "validation_or_evidence_refs": [
        "docs/project-buildout/14-adr-0009-source-strategy-decision-packet.md",
        "docs/project-buildout/15-adr-0009-evidence-traceability-matrix.md",
        "docs/project-buildout/16-adr-0009-decision-draft.md",
        "docs/blueprint-v1/machine/adr-0009-evidence.json",
        "tools/validate_adr_0009_evidence.py"
      ]
    },
    {
      "id": "PB-003",
      "name": "Toolkit-neutral UI model and adapter contract",
      "status": "partial",
      "owner_scope": "ui-runtime",
      "current_evidence": [
        "Checked toolkit-neutral UI adapter contract inventory exists for state, command, surface, accessibility, diagnostic, adapter, M0 model invariants, and denied toolkit-owned authority."
      ],
      "required_before_m1": [
        "Accepted ADR-0013, complete toolkit-neutral state/command/surface/accessibility/diagnostic/adapter contracts, native adapter prototype evidence, no-toolkit-owned-authority negative tests, and owner review before native-shell or release-path UI claims."
      ],
      "first_next_actions": [
        "Draft the ADR-0013 contract decision and first native adapter trait prototype with command-only toolkit callbacks and denied-authority tests."
      ],
      "owner_only_decisions": [
        "Accept ADR-0013, approve the adapter contract, and accept any trusted-chrome, accessibility, page-surface, or release-path UI exception."
      ],
      "prohibited_claims": [
        "No ADR-0013 acceptance, native-shell readiness, native adapter prototype claim, toolkit selection, trusted-chrome readiness, accessibility readiness, page-surface approval, or release-path UI approval."
      ],
      "validation_or_evidence_refs": [
        "docs/research/toolkit-neutral-ui-adapter-contract-inventory-2026-07.md",
        "docs/ui-runtime/machine/adapter-contract-inventory.json",
        "tools/validate_ui_adapter_contract.py"
      ]
    },
    {
      "id": "PB-004",
      "name": "Native UI framework selection",
      "status": "partial",
      "owner_scope": "ui-runtime",
      "current_evidence": [
        "Checked native UI framework bake-off inventory exists for candidate summaries, external observations, equivalent adapter scope, evidence axes, disqualifiers, and unsupported boundaries."
      ],
      "required_before_m1": [
        "Equivalent Slint, Vizia, and Floem or GPUI adapter runs or owner-approved reduced scope, accepted ADR-0014, accessibility, IME, keyboard, crash/GPU-loss, startup, memory, binary, latency, frame-pacing, energy, license, dependency, provenance, replacement, package, and runtime-exclusion evidence."
      ],
      "first_next_actions": [
        "Create the first reference-shell adapter execution manifest and artifact contract before narrowing the production toolkit set."
      ],
      "owner_only_decisions": [
        "Accept ADR-0014, select the UI toolkit or adapter strategy, and approve any reduced bake-off scope or package/runtime exclusion exception."
      ],
      "prohibited_claims": [
        "No UI toolkit selection, ADR-0014 acceptance, equivalent adapter evidence claim, accessibility readiness, IME/keyboard proof, license/provenance approval, page-surface approval, trusted-chrome readiness, or release-path UI approval."
      ],
      "validation_or_evidence_refs": [
        "docs/research/native-ui-framework-bakeoff-inventory-2026-07.md",
        "docs/ui-runtime/machine/framework-bakeoff-inventory.json",
        "tools/validate_framework_bakeoff.py"
      ]
    },
    {
      "id": "PB-005",
      "name": "Page-surface and compositor composition",
      "status": "partial",
      "owner_scope": "ui-runtime",
      "current_evidence": [
        "Checked page-surface composition inventory exists for surface contract fields, composition alternatives, UI-GATE-7 workflow rows, failure cases, identity boundaries, and blockers."
      ],
      "required_before_m1": [
        "Executable UI-GATE-7 prototype, accepted ADR-0016, typed page-surface handles, brokered surface handles, document/device generations, renderer-texture composition, software fallback, stale-handle negative tests, resize, scale, damage, input, IME, accessibility, occlusion, capture, renderer crash, GPU-loss, latency, frame-pacing, and owner review."
      ],
      "first_next_actions": [
        "Implement the smallest no-release page-surface protocol spike and record handle-generation, stale-handle, and renderer-fault behavior."
      ],
      "owner_only_decisions": [
        "Accept ADR-0016, decide compositor ownership, accept UI-GATE-7, and approve page-surface release-path evidence."
      ],
      "prohibited_claims": [
        "No page-surface approval, compositor ownership decision, UI-GATE-7 approval, ADR-0016 acceptance, renderer-texture composition proof, software fallback claim, latency/frame-pacing claim, or release-path UI approval."
      ],
      "validation_or_evidence_refs": [
        "docs/research/page-surface-composition-inventory-2026-07.md",
        "docs/ui-runtime/machine/page-surface-composition.json",
        "tools/validate_page_surface_composition.py"
      ]
    },
    {
      "id": "PB-009",
      "name": "Bootstrap and read-only doctor commands",
      "status": "partial",
      "owner_scope": "release-operations",
      "current_evidence": [
        "Checked fresh-host reproduction inventory, run-record template, and fresh-host readiness-review template exist for clean-host facts, source identity, bootstrap/doctor/check/xtask output, cache and target-directory behavior, source-tree cleanliness, failure classification, owner-review handoff, and rejection rules."
      ],
      "required_before_m1": [
        "Independent fresh-host reproduction or owner-approved clean-VM equivalent with exact OS, shell, Rust, Cargo, Git, cache, target directory, temp directory, source-tree cleanliness, retained bootstrap/doctor/check/xtask logs, failure classification, rollback notes, and owner-reviewed fresh-host readiness beyond the checked no-claim fresh-host readiness-review template."
      ],
      "first_next_actions": [
        "Run the reproduction protocol on the designated fresh host or clean VM, attach retained logs and cache/target/source-cleanliness evidence, and replace the checked no-claim fresh-host readiness-review template with owner-reviewed evidence."
      ],
      "owner_only_decisions": [
        "Designate the reference host, accept or reject clean-VM equivalence, accept environmental waivers, accept or reject the fresh-host readiness review, and promote PB-009 only after retained evidence is reviewed."
      ],
      "prohibited_claims": [
        "No owner-reviewed fresh-host readiness, independent reproducibility, PB-009 readiness, broad M1 readiness, preview readiness, beta readiness, stable readiness, production readiness, release confidence, implementation, or Chrome-class claim from same-host reruns or no-claim templates."
      ],
      "validation_or_evidence_refs": [